{
  "$schema": "../five-frame-manifest.schema.json",
  "version": 1,
  "id": "manual-five-frame-calibration",
  "label": "Manual — floating service robot calibration",
  "reportDirectory": "../reports/manual-five-frame-calibration",
  "logicalCanvas": {
    "width": 320,
    "height": 421
  },
  "deliveryCanvas": {
    "width": 960,
    "height": 1264
  },
  "pixelScale": 3,
  "finalRow": {
    "count": 1,
    "mode": "duplicate-last"
  },
  "baseState": "idle-1",
  "palette": {
    "maxColors": 24,
    "mode": "subset-of-base",
    "includeTransparent": false
  },
  "registrationSearchRadius": 3,
  "frames": [
    {
      "id": "idle-1",
      "file": "../../../../public/images/bazaar3/assets/stalls/manual-v3/frames/idle-1.png",
      "requireMotion": false
    },
    {
      "id": "idle-2",
      "file": "../../../../public/images/bazaar3/assets/stalls/manual-v3/frames/idle-2.png",
      "requireMotion": true,
      "motionMask": {
        "regions": [
          {
            "kind": "rect",
            "x": 116,
            "y": 104,
            "width": 91,
            "height": 42
          }
        ]
      }
    },
    {
      "id": "hover-1",
      "file": "../../../../public/images/bazaar3/assets/stalls/manual-v3/frames/hover-1.png",
      "requireMotion": true,
      "motionMask": {
        "regions": [
          {
            "kind": "rect",
            "x": 116,
            "y": 104,
            "width": 91,
            "height": 42
          }
        ]
      }
    },
    {
      "id": "hover-2",
      "file": "../../../../public/images/bazaar3/assets/stalls/manual-v3/frames/hover-2.png",
      "requireMotion": true,
      "motionMask": {
        "regions": [
          {
            "kind": "rect",
            "x": 116,
            "y": 104,
            "width": 91,
            "height": 42
          },
          {
            "kind": "polygon",
            "points": [[86, 141], [115, 145], [115, 174], [91, 191], [76, 181]]
          },
          {
            "kind": "polygon",
            "points": [
              [204, 142],
              [232, 132],
              [255, 139],
              [245, 177],
              [210, 186]
            ]
          },
          {
            "kind": "polygon",
            "points": [
              [132, 184],
              [146, 175],
              [159, 187],
              [140, 220],
              [116, 224]
            ]
          }
        ]
      }
    },
    {
      "id": "hover-3",
      "file": "../../../../public/images/bazaar3/assets/stalls/manual-v3/frames/hover-3.png",
      "requireMotion": true,
      "motionMask": {
        "regions": [
          {
            "kind": "rect",
            "x": 116,
            "y": 104,
            "width": 91,
            "height": 42
          },
          {
            "kind": "polygon",
            "points": [[86, 141], [115, 145], [115, 174], [91, 191], [76, 181]]
          },
          {
            "kind": "polygon",
            "points": [
              [204, 142],
              [232, 132],
              [255, 139],
              [245, 177],
              [210, 186]
            ]
          },
          {
            "kind": "polygon",
            "points": [
              [132, 184],
              [146, 175],
              [159, 187],
              [140, 220],
              [116, 224]
            ]
          }
        ]
      }
    }
  ],
  "lockedRegions": [
    {
      "id": "manual-sign",
      "category": "sign",
      "x": 70,
      "y": 40,
      "width": 190,
      "height": 55
    },
    {
      "id": "counter-top-and-front",
      "category": "counter",
      "x": 35,
      "y": 215,
      "width": 250,
      "height": 68
    },
    {
      "id": "floor-and-trench",
      "category": "floor",
      "x": 0,
      "y": 347,
      "width": 320,
      "height": 74
    },
    {
      "id": "background-left-frame",
      "category": "background",
      "x": 0,
      "y": 0,
      "width": 42,
      "height": 347
    },
    {
      "id": "background-right-frame",
      "category": "background",
      "x": 278,
      "y": 0,
      "width": 42,
      "height": 347
    },
    {
      "id": "background-rear-left-top",
      "category": "background",
      "x": 42,
      "y": 95,
      "width": 62,
      "height": 45
    },
    {
      "id": "background-rear-left-outer",
      "category": "background",
      "x": 42,
      "y": 140,
      "width": 34,
      "height": 52
    },
    {
      "id": "background-rear-left-bottom",
      "category": "background",
      "x": 42,
      "y": 192,
      "width": 62,
      "height": 19
    },
    {
      "id": "background-rear-right-top",
      "category": "background",
      "x": 216,
      "y": 95,
      "width": 62,
      "height": 37
    },
    {
      "id": "background-rear-right-outer",
      "category": "background",
      "x": 255,
      "y": 132,
      "width": 23,
      "height": 55
    },
    {
      "id": "background-rear-right-bottom",
      "category": "background",
      "x": 216,
      "y": 187,
      "width": 62,
      "height": 24
    }
  ],
  "torsoRegions": [
    {
      "id": "robot-torso",
      "x": 122,
      "y": 147,
      "width": 76,
      "height": 51
    }
  ],
  "rootRegions": [
    {
      "id": "floating-root-thruster",
      "x": 140,
      "y": 198,
      "width": 42,
      "height": 17
    }
  ],
  "shoulderRootRegions": [
    {
      "id": "left-shoulder-root",
      "x": 109,
      "y": 158,
      "width": 10,
      "height": 12
    },
    {
      "id": "right-shoulder-root",
      "x": 198,
      "y": 158,
      "width": 10,
      "height": 12
    },
    {
      "id": "front-shoulder-root",
      "x": 137,
      "y": 177,
      "width": 11,
      "height": 12
    }
  ],
  "registrationAnchors": [
    {
      "id": "upper-left-beam-anchor",
      "x": 12,
      "y": 8,
      "width": 24,
      "height": 22
    },
    {
      "id": "upper-right-beam-anchor",
      "x": 284,
      "y": 8,
      "width": 24,
      "height": 22
    },
    {
      "id": "lower-left-floor-anchor",
      "x": 18,
      "y": 371,
      "width": 24,
      "height": 26
    },
    {
      "id": "lower-right-floor-anchor",
      "x": 278,
      "y": 371,
      "width": 24,
      "height": 26
    }
  ],
  "designReviewZones": [
    {
      "id": "overhead-beam",
      "kind": "rect",
      "x": 0,
      "y": 7,
      "width": 320,
      "height": 32,
      "color": "#f4c95d"
    },
    {
      "id": "left-column",
      "kind": "rect",
      "x": 0,
      "y": 0,
      "width": 42,
      "height": 347,
      "color": "#55d6ff"
    },
    {
      "id": "right-column",
      "kind": "rect",
      "x": 278,
      "y": 0,
      "width": 42,
      "height": 347,
      "color": "#55d6ff"
    },
    {
      "id": "manual-sign",
      "kind": "rect",
      "x": 70,
      "y": 40,
      "width": 190,
      "height": 55,
      "color": "#ff8f70"
    },
    {
      "id": "rear-aisle-receiver",
      "kind": "rect",
      "x": 42,
      "y": 95,
      "width": 236,
      "height": 116,
      "color": "#53e0b1"
    },
    {
      "id": "eye-stalk-envelope",
      "kind": "rect",
      "x": 116,
      "y": 104,
      "width": 91,
      "height": 42,
      "color": "#b68cff"
    },
    {
      "id": "torso-box",
      "kind": "rect",
      "x": 122,
      "y": 147,
      "width": 76,
      "height": 51,
      "color": "#ff5b8f"
    },
    {
      "id": "torso-center",
      "kind": "cross",
      "x": 160,
      "y": 172,
      "size": 7,
      "color": "#ffffff"
    },
    {
      "id": "left-shoulder-root",
      "kind": "rect",
      "x": 109,
      "y": 158,
      "width": 10,
      "height": 12,
      "color": "#ffef62"
    },
    {
      "id": "right-shoulder-root",
      "kind": "rect",
      "x": 198,
      "y": 158,
      "width": 10,
      "height": 12,
      "color": "#ffef62"
    },
    {
      "id": "front-shoulder-root",
      "kind": "rect",
      "x": 137,
      "y": 177,
      "width": 11,
      "height": 12,
      "color": "#ffef62"
    },
    {
      "id": "arm-envelope",
      "kind": "polygon",
      "points": [
        [76, 132],
        [255, 132],
        [255, 187],
        [159, 187],
        [140, 224],
        [116, 224],
        [91, 191],
        [76, 181]
      ],
      "color": "#68a6ff"
    },
    {
      "id": "thruster-nozzle",
      "kind": "rect",
      "x": 140,
      "y": 198,
      "width": 42,
      "height": 17,
      "color": "#ff9c43"
    },
    {
      "id": "counter-top",
      "kind": "rect",
      "x": 35,
      "y": 215,
      "width": 250,
      "height": 14,
      "color": "#ffffff"
    },
    {
      "id": "counter-front",
      "kind": "rect",
      "x": 35,
      "y": 229,
      "width": 250,
      "height": 54,
      "color": "#dc7cff"
    },
    {
      "id": "floor-trench",
      "kind": "rect",
      "x": 0,
      "y": 347,
      "width": 320,
      "height": 74,
      "color": "#5ee6d1"
    }
  ]
}
